{
  "$schema": "https://json-schema.org/draft/2020-12/schema",
  "type": "object",
  "properties": {
    "bt_run_id": {
      "type": "string"
    },
    "window_id": {
      "type": "string"
    },
    "status": {
      "type": "string",
      "enum": [
        "complete",
        "void",
        "ok",
        "stale",
        "failed",
        "unavailable",
        "validated",
        "reproducible",
        "unvalidated",
        "withdrawn"
      ]
    },
    "result_sha256": {
      "type": "string"
    },
    "code_git_sha": {
      "type": "string"
    },
    "generated_utc": {
      "type": "string",
      "pattern": "^\\d{4}-\\d{2}-\\d{2}T\\d{2}:\\d{2}:\\d{2}(\\.\\d+)?Z$"
    },
    "controls": {
      "anyOf": [
        {
          "type": [
            "string",
            "number",
            "boolean",
            "null"
          ]
        },
        {
          "type": "object",
          "propertyNames": {
            "type": "string"
          },
          "additionalProperties": {}
        },
        {
          "type": "array",
          "items": {}
        }
      ]
    },
    "clv_summary": {
      "anyOf": [
        {
          "anyOf": [
            {
              "type": [
                "string",
                "number",
                "boolean",
                "null"
              ]
            },
            {
              "type": "object",
              "propertyNames": {
                "type": "string"
              },
              "additionalProperties": {}
            },
            {
              "type": "array",
              "items": {}
            }
          ]
        },
        {
          "type": "null"
        }
      ]
    }
  },
  "required": [
    "bt_run_id",
    "window_id",
    "status",
    "result_sha256",
    "code_git_sha",
    "generated_utc",
    "controls"
  ],
  "additionalProperties": false
}
