[{"bt_run_id":"nfl_games_v1:7244a0bc8ac6","window_id":"nfl_games_v1","status":"complete","result_sha256":"7244a0bc8ac63fec4d8d11b48b4b93be4ebf3fdba51b0fa3d6929cab336a3458","code_git_sha":"c7d8bcee7887cacdc00e5ff4bd041c2485609dc7","generated_utc":"2026-09-29T20:02:13Z","controls":{"leak_canary":{"assertion_rejected":true,"bypass_skill":0.7037538232,"bypass_flagged":true,"passed":true},"implausible_skill_guard":{"threshold":0.05,"max_candidate_skill":0.0002313053,"passed":true},"shuffled_labels":{"seed":20260930,"reference":"expanding-window climatology","skill_ci_lower":{"C1":-0.1022832339,"C2":-0.0107508699,"E1":-0.0440108996,"B1[C1]":-0.0145307408,"B1[C2]":-0.0094207738,"B1[E1]":-0.0130794511,"B2[E1]":-0.1384876163,"K[E1]":-0.0089897323},"skill":{"C1":-0.0670498838,"C2":-0.0050529692,"E1":-0.0261361855,"B1[C1]":-0.0085290945,"B1[C2]":-0.0039436647,"B1[E1]":-0.007615325,"B2[E1]":-0.0779210068,"K[E1]":-0.0047479595},"passed":true},"market_copy":{"skill":0,"brier_diff":0,"b1_total_market_slope":1.0551715334,"slope_band":[0.85,1.15],"passed":true},"reproducibility":{"first":"7244a0bc8ac63fec4d8d11b48b4b93be4ebf3fdba51b0fa3d6929cab336a3458","second":"7244a0bc8ac63fec4d8d11b48b4b93be4ebf3fdba51b0fa3d6929cab336a3458","passed":true},"all_passed":true,"run_status":"complete"},"clv_summary":{"C1":{"n":207,"n_home":101,"mean_clv_bps":-19.1981174545,"clv_ci":[-107.045198716,60.7246376462],"roi":-0.0034217168,"roi_ci":[-0.1767956117,0.1893443632],"hit_rate":0.4782608696},"C2":{"n":214,"n_home":129,"mean_clv_bps":92.5169007712,"clv_ci":[39.5421432161,148.8933015383],"roi":-0.0701529511,"roi_ci":[-0.2276696227,0.093252103],"hit_rate":0.4719626168},"E1":{"n":200,"n_home":110,"mean_clv_bps":51.6768700875,"clv_ci":[-12.2025139873,116.809163588],"roi":-0.0270274923,"roi_ci":[-0.1835924175,0.1323677903],"hit_rate":0.48},"K[E1]":{"n":199,"n_home":108,"mean_clv_bps":65.7392587496,"clv_ci":[7.9156280168,124.7843975023],"roi":-0.0155040187,"roi_ci":[-0.1645704188,0.1361808836],"hit_rate":0.5175879397},"meta":{"venue":"ESPN BET","seasons":2024,"games_with_opener":284,"tau":0.03}}}]
